{
  "schemaVersion": "ncc-l2-anchor-batch-summary/v1",
  "batchID": "1",
  "l2ChainID": "31337",
  "l1ChainID": "1",
  "admissionContract": "0xDc64a140Aa3E981100a9becA4E685f962f0cF6C9",
  "anchorContract": "0xe7f1725E7734CE288F8367e1Bb143E90bb3F0512",
  "fromStateRoot": "21551820661461729022865262380882070649935529853313286572328683688269863701601",
  "toStateRoot": "9004445721392407617765566758736899121143153381771154831081323089196260973334",
  "acceptedActionRoot": "825753323390905507518259102144280896027719863943895405943771330991716783838",
  "nullifierDigest": "9692551634249866530663825495128701624707395296105506960962757707055664845003",
  "stateCommitmentDigest": "11231430189842243701069274020112470633648989728697041735228245167720319312133",
  "count": "3",
  "firstL2Block": "1",
  "lastL2Block": "3",
  "batchStartTime": "2026-07-03T00:00:00.000Z",
  "batchEndTime": "2026-07-03T00:05:00.000Z",
  "batchDigest": "12757940102241886442523519944768779968832577997391259206706178581984833667310",
  "digestAlgorithm": "poseidon-bn254-field-v1",
  "fieldEncoding": "decimal-string-bn254",
  "source": {
    "baselineCommit": "f910bb1",
    "architectureCommit": "728aade",
    "demo": "M11 full local demo",
    "measurement": "M12 measurement report"
  },
  "privacy": {
    "forbiddenFieldsExcluded": true,
    "containsPlainAmount": false,
    "containsOwner": false,
    "containsOldStateCommitment": false,
    "containsUsedAmount": false,
    "containsMerklePaths": false,
    "containsUserLevelTag": false
  },
  "records": [
    {
      "type": "init",
      "recordIndex": "0",
      "stateCommitment": "18642456385847559776773798185157556476501869169874141018486943258724472976549",
      "stateRootAfter": "6184715872336434441857866957448557330732440228231919952177520071042425498083",
      "nullifier": "17766401949085797926135549035069317269837656481692000435383030373734283992943",
      "rho": null,
      "actionHash": null,
      "amountCom": null,
      "clauseCom": null
    },
    {
      "type": "update",
      "recordIndex": "1",
      "rtState": "6184715872336434441857866957448557330732440228231919952177520071042425498083",
      "nullifier": "14934302190736785102208117273035656483358851212503323996995017720330640038675",
      "stateCommitment": "7485856653831390384908723730177777619501831971191651667486568338578887580542",
      "stateRootAfter": "18214468675329363424914426193265284265526863822044876243062858448795993613495",
      "rho": "12734960571478142793239939966609539292957667552557480174177333018055464002592",
      "actionHash": "15431768514139257405190146949538713766171895702271871013370720760190766607703",
      "amountCom": "4052888969813845085336314589908854524791284491943363627709942801413724245159",
      "clauseCom": "13675817769420183571413921360343371190282216001608048934971235106962693403857"
    },
    {
      "type": "update",
      "recordIndex": "2",
      "rtState": "18214468675329363424914426193265284265526863822044876243062858448795993613495",
      "nullifier": "8825737093858097162518663024481547741190203876351136303781089647340345102506",
      "stateCommitment": "2874382034630353336894133450952975223841290626084311208159484806949048523422",
      "stateRootAfter": "9004445721392407617765566758736899121143153381771154831081323089196260973334",
      "rho": "19167179697200692285661804443808434675575536330458288699935270006387337649736",
      "actionHash": "21718417864773885484144376032692000056052491591600380839884459381005560608895",
      "amountCom": "6152682687489577387770139482597855173241424913830733204248807161757473009807",
      "clauseCom": "3416446450593359103395228978728400518363330452116282147308543180073405258441"
    }
  ]
}
